profile_link,education
https://www.whitecase.com/people/andrew-weisberg,BA Syracuse University
https://www.whitecase.com/people/colin-west,JD Duke University School of Law
https://www.whitecase.com/people/colin-west,BA Wake Forest University
https://www.whitecase.com/people/keith-wofford,JD Harvard Law School
https://www.whitecase.com/people/keith-wofford,AB Harvard College
https://www.whitecase.com/people/clark-wohlferd,JD New York University School of Law
https://www.whitecase.com/people/clark-wohlferd,BA Macalester College
https://www.whitecase.com/people/todd-wolynski,JD Georgetown University Law Center
https://www.whitecase.com/people/todd-wolynski,BA American University
https://www.whitecase.com/people/todd-wolynski,
https://www.whitecase.com/people/brendan-woodard,JD Fordham University School of Law
https://www.whitecase.com/people/brendan-woodard,BA Siena College
https://www.whitecase.com/people/oliver-wright,Bachelor of Laws Bond University Australia
https://www.whitecase.com/people/oliver-wright,Bachelor of Commerce Accounting / Finance Bond University Australia
https://www.whitecase.com/people/oliver-wright,"Graduate Diploma in Legal Practice, Skills & Ethics Griffith University Australia"
https://www.whitecase.com/people/kristen-young,JD Georgetown University Law Center
https://www.whitecase.com/people/kristen-young,DESS Global Economic Law Institut d'Etudes Politiques de Paris/Universite Paris I (Pantheon-Sorbonne)
https://www.whitecase.com/people/kristen-young,MSc International Relations London School of Economics and Political Science
https://www.whitecase.com/people/kristen-young,BA Wellesley College
https://www.whitecase.com/people/jason-zakia,JD New York University School of Law
https://www.whitecase.com/people/jason-zakia,BA State University of New York at Albany
https://www.whitecase.com/people/andrew-zatz,JD Fordham University School of Law
https://www.whitecase.com/people/andrew-zatz,BA Tufts University
https://www.whitecase.com/people/mingda-zhao,JD Georgetown University Law Center
https://www.whitecase.com/people/mingda-zhao,BA Hampshire College
https://www.whitecase.com/people/francis-zou,JD Columbia University School of Law
https://www.whitecase.com/people/francis-zou,BA Hunan Normal University
https://www.whitecase.com/people/troy-alexander,JD New York University School of Law
https://www.whitecase.com/people/troy-alexander,"MPA Princeton University, Woodrow Wilson School of Public and International Affairs"
https://www.whitecase.com/people/troy-alexander,BA Haverford College Watson Fellowship
https://www.whitecase.com/people/marie-elena-angulo,JD Yale University
https://www.whitecase.com/people/marie-elena-angulo,MPhil Yale University
https://www.whitecase.com/people/marie-elena-angulo,BA Princeton University
https://www.whitecase.com/people/laura-baccash,JD University of Illinois
https://www.whitecase.com/people/laura-baccash,BA Cornell University
https://www.whitecase.com/people/dean-barclay,JD Washington and Lee University School of Law
https://www.whitecase.com/people/dean-barclay,"MA, PhD English Harvard University"
https://www.whitecase.com/people/dean-barclay,BA English Haverford College
https://www.whitecase.com/people/kenneth-barr,JD Temple University Beasley School of Law
https://www.whitecase.com/people/kenneth-barr,BS College of William & Mary
https://www.whitecase.com/people/william-bave,JD Fordham University School of Law
https://www.whitecase.com/people/william-bave,BS University of Richmond
https://www.whitecase.com/people/jessie-baxter,JD University of San Diego
https://www.whitecase.com/people/jessie-baxter,BS Finance Boston College
https://www.whitecase.com/people/ryan-brady,JD Washington and Lee University School of Law
https://www.whitecase.com/people/ryan-brady,BA University of Notre Dame
https://www.whitecase.com/people/peter-chessick,"MSFS, International Business Diplomacy Georgetown University"
https://www.whitecase.com/people/peter-chessick,JD Georgetown University Law Center
https://www.whitecase.com/people/peter-chessick,AB Stanford University
https://www.whitecase.com/people/jacqueline-chung,"JD Marshall-Wythe School of Law, College of William & Mary"
https://www.whitecase.com/people/jacqueline-chung,BA Yale University
https://www.whitecase.com/people/lindsay-mishcon-cohen,JD Harvard Law School
https://www.whitecase.com/people/lindsay-mishcon-cohen,BS University of Florida
https://www.whitecase.com/people/earl-comstock,JD George Mason University School of Law (Antonin Scalia Law School)
https://www.whitecase.com/people/earl-comstock,BA Political Science University of California Santa Barbara
https://www.whitecase.com/people/jaime-crowe,JD George Washington University Law School
https://www.whitecase.com/people/jaime-crowe,BA George Mason University
https://www.whitecase.com/people/glen-cuccinello,JD Harvard Law School
https://www.whitecase.com/people/glen-cuccinello,AB Harvard College
https://www.whitecase.com/people/j-william-dantzler,JD New York University School of Law
https://www.whitecase.com/people/j-william-dantzler,BS Clemson University
https://www.whitecase.com/people/amy-delsack,JD UCLA School of Law
https://www.whitecase.com/people/amy-delsack,BS Cornell University
https://www.whitecase.com/people/victor-desantis,JD Harvard Law School
https://www.whitecase.com/people/victor-desantis,BA Yale University
https://www.whitecase.com/people/amy-donehower,JD Columbia Law School
https://www.whitecase.com/people/amy-donehower,MS Teaching Fordham University
https://www.whitecase.com/people/amy-donehower,BA History University of Chicago
https://www.whitecase.com/people/john-donovan,JD Harvard Law School
https://www.whitecase.com/people/john-donovan,AB Harvard College
https://www.whitecase.com/people/claudette-druehl,JD Boston University School of Law
https://www.whitecase.com/people/claudette-druehl,BA Newcomb College of Tulane University
https://www.whitecase.com/people/elodie-gal,LLM Duke University School of Law
https://www.whitecase.com/people/elodie-gal,DESS Post-Graduate Degree in Space Technology and Telecommunication Law Universite de Paris XI
https://www.whitecase.com/people/elodie-gal,Master's Degree International and European Law Universite de Paris XI
https://www.whitecase.com/people/evan-goldenberg,JD The George Washington University Law School
https://www.whitecase.com/people/evan-goldenberg,"MS University of California, Los Angeles"
https://www.whitecase.com/people/evan-goldenberg,BS Tufts University
https://www.whitecase.com/people/eugene-goodwillie-jr,JD Columbia Law School
https://www.whitecase.com/people/eugene-goodwillie-jr,BA Williams College
https://www.whitecase.com/people/richard-graham,JD University of Washington School of Law
https://www.whitecase.com/people/richard-graham,"BS United States Military Academy West Point, NY"
https://www.whitecase.com/people/michelle-grando,LLM Harvard Law School
https://www.whitecase.com/people/michelle-grando,SJD University of Toronto
https://www.whitecase.com/people/michelle-grando,LLM University of Toronto
https://www.whitecase.com/people/michelle-grando,LLB Federal University of Santa Catarina Brazil
https://www.whitecase.com/people/emilio-grandio,JD University of Houston Law Center
https://www.whitecase.com/people/emilio-grandio,LLB Universidad Anahuac del Norte
https://www.whitecase.com/people/jesse-green,JD University of Virginia School of Law
https://www.whitecase.com/people/jesse-green,BA Swarthmore College
https://www.whitecase.com/people/lauren-greenberg,Juris Doctor Columbus School of Law Catholic University of America
https://www.whitecase.com/people/lauren-greenberg,Bachelor's Degree Dartmouth College
https://www.whitecase.com/people/neal-grenley,JD Columbia Law School
https://www.whitecase.com/people/neal-grenley,Princeton University
https://www.whitecase.com/people/mark-gustafson,JD University of Southern California
https://www.whitecase.com/people/mark-gustafson,"BS University of California, Berkeley"
https://www.whitecase.com/people/fern-han,LLB London School of Economics
https://www.whitecase.com/people/henrikki-harsu,BSc Helsinki School of Economics
https://www.whitecase.com/people/henrikki-harsu,LLM Fordham University School of Law
https://www.whitecase.com/people/henrikki-harsu,LLM Helsinki University School of Law
https://www.whitecase.com/people/james-hayden,JD Harvard Law School
https://www.whitecase.com/people/james-hayden,Harvard College
https://www.whitecase.com/people/fan-he,JD Emory University School of Law
https://www.whitecase.com/people/fan-he,MA Economics New York University
https://www.whitecase.com/people/fan-he,BA Economics New York University
https://www.whitecase.com/people/eckhard-hellbeck,Dusseldorf
https://www.whitecase.com/people/eckhard-hellbeck,"LLM American University, Washington College of Law Washington College of Law"
https://www.whitecase.com/people/eckhard-hellbeck,First State Exam Berlin
https://www.whitecase.com/people/eckhard-hellbeck,Freie Universitat Berlin
https://www.whitecase.com/people/eckhard-hellbeck,Hague Academy of International Law
https://www.whitecase.com/people/eckhard-hellbeck,Universitat des Saarlandes Saarbrucken
https://www.whitecase.com/people/douglas-jasinski,JD The Catholic University of America Columbus School of Law
https://www.whitecase.com/people/douglas-jasinski,BA The Catholic University of America
https://www.whitecase.com/people/anthony-kahn,JD University of Notre Dame magna cum laude
https://www.whitecase.com/people/anthony-kahn,MBA University of Notre Dame summa cum laude
https://www.whitecase.com/people/anthony-kahn,BA Economics Wake Forest University
https://www.whitecase.com/people/ting-ting-kao,JD The George Washington University Law School
https://www.whitecase.com/people/ting-ting-kao,MIA International Economic Policy Columbia University School of International and Public Affairs
https://www.whitecase.com/people/ting-ting-kao,BA Political Science and Economics Barnard College of Columbia University
https://www.whitecase.com/people/karen-katri,JD Northwestern University School of Law
https://www.whitecase.com/people/karen-katri,Harvard University
https://www.whitecase.com/people/nicolle-kownacki,JD Public Interest Law & Policy Program UCLA School of Law
https://www.whitecase.com/people/nicolle-kownacki,BSFS Georgetown University School of Foreign Service
https://www.whitecase.com/people/amy-kurland,Juris Doctor University of Wisconsin Madison
https://www.whitecase.com/people/amy-kurland,Bachelor of Science University of Illinois
https://www.whitecase.com/people/lucius-lau,JD Georgetown University Law Center
https://www.whitecase.com/people/lucius-lau,BA Stanford University Economics (with departmental honors)
https://www.whitecase.com/people/matthew-leddicotte,JD Georgetown University Law Center
https://www.whitecase.com/people/matthew-leddicotte,BBA George Washington University
https://www.whitecase.com/people/scott-lerner,BA Emory University
https://www.whitecase.com/people/scott-lerner,JD Georgetown University Law Center
https://www.whitecase.com/people/debra-kobrin-levy,JD Fordham University School of Law
https://www.whitecase.com/people/debra-kobrin-levy,MSW Fordham Graduate School of Social Service
https://www.whitecase.com/people/debra-kobrin-levy,BA University of Pennsylvania
https://www.whitecase.com/people/matthew-linder,JD Cornell Law School
https://www.whitecase.com/people/matthew-linder,BA Northwestern University
https://www.whitecase.com/people/dianne-lu,JD Northeastern University School of Law
https://www.whitecase.com/people/dianne-lu,BA Yale University
https://www.whitecase.com/people/cecily-maguire,LLM New York University School of Law
https://www.whitecase.com/people/cecily-maguire,JD University of Virginia School of Law
https://www.whitecase.com/people/cecily-maguire,BA Harvard University
https://www.whitecase.com/people/patti-marks,JD Boston University School of Law
https://www.whitecase.com/people/patti-marks,BA Cornell University
https://www.whitecase.com/people/katherine-mccullough,JD Georgetown University Law Center
https://www.whitecase.com/people/katherine-mccullough,BA McGill University
https://www.whitecase.com/people/michele-j-meises,JD Columbia University School of Law
https://www.whitecase.com/people/michele-j-meises,Columbia University Columbia College
https://www.whitecase.com/people/earle-miller,"JD University of Chicago Chicago, Ill."
https://www.whitecase.com/people/earle-miller,"AB, Linguistics Harvard University Cambridge, Mass."
https://www.whitecase.com/people/clyde-mitchell,"New York University, Graduate School of Business Administration Graduate School of Business Administration"
https://www.whitecase.com/people/clyde-mitchell,JD Fordham University School of Law
https://www.whitecase.com/people/clyde-mitchell,BA Rutgers University
https://www.whitecase.com/people/charles-moore,JD Howard University
https://www.whitecase.com/people/charles-moore,BA Howard University
https://www.whitecase.com/people/roger-noble,JD Cornell University Law School
https://www.whitecase.com/people/roger-noble,BS Clarkson University
https://www.whitecase.com/people/daniel-nussen,JD New York University School of Law
https://www.whitecase.com/people/daniel-nussen,BA Northwestern University
https://www.whitecase.com/people/terry-obrien,JD St. John's University School of Law
https://www.whitecase.com/people/terry-obrien,BS Accounting St. John's University
https://www.whitecase.com/people/louis-oneill,JD Harvard Law School
https://www.whitecase.com/people/louis-oneill,MA Stanford University
https://www.whitecase.com/people/louis-oneill,Moscow State University
https://www.whitecase.com/people/louis-oneill,BA Stanford University
https://www.whitecase.com/people/marten-olsson,LLM Georgetown University Law Center
https://www.whitecase.com/people/marten-olsson,Juris kandidat (LLM) University of Stockholm
https://www.whitecase.com/people/jeremy-ostrander,"JD University of California, Berkeley"
https://www.whitecase.com/people/jeremy-ostrander,BS/BA University of Arizona
https://www.whitecase.com/people/owen-pell,Hon. PhD (Doctor of Laws) State University of New York at Binghamton
https://www.whitecase.com/people/owen-pell,JD University of Virginia School of Law
https://www.whitecase.com/people/owen-pell,BA State University of New York at Binghamton Phi Beta Kappa
https://www.whitecase.com/people/suzanne-perry,Juris Doctor Yale Law School
https://www.whitecase.com/people/suzanne-perry,Bachelor of Arts Cornell University
https://www.whitecase.com/people/suzanne-perry,Master of Laws European University Institute
https://www.whitecase.com/people/suzanne-perry,"Latin American Private Equity Executive Program, Wharton/LAVCA Executive Education"
https://www.whitecase.com/people/paul-pittman,JD Washington and Lee University School of Law
https://www.whitecase.com/people/paul-pittman,BS Allegheny College
https://www.whitecase.com/people/ira-raphaelson,BA Northwestern University
https://www.whitecase.com/people/ira-raphaelson,JD Northwestern University
https://www.whitecase.com/people/nicole-rodger,JD Pepperdine University School of Law
https://www.whitecase.com/people/nicole-rodger,BA Pepperdine University
https://www.whitecase.com/people/michael-rodgers,LLM Taxation New York University School of Law
https://www.whitecase.com/people/michael-rodgers,JD Arizona State University
https://www.whitecase.com/people/michael-rodgers,BA Government Cornell University
https://www.whitecase.com/people/winthrop-rutherfurd,LLB University of Virginia School of Law
https://www.whitecase.com/people/winthrop-rutherfurd,BA Princeton University
https://www.whitecase.com/people/heidi-schmid,LLM Tax Georgetown University Law Center
https://www.whitecase.com/people/heidi-schmid,Certificate in Employee Benefits Georgetown University Law Center
https://www.whitecase.com/people/heidi-schmid,JD Benjamin N. Cardozo School of Law Yeshiva University
https://www.whitecase.com/people/heidi-schmid,BS History Oregon State University
https://www.whitecase.com/people/frank-schweitzer,LLM International Law Georgetown University Law Center
https://www.whitecase.com/people/frank-schweitzer,JD Capital University Law School
https://www.whitecase.com/people/frank-schweitzer,BA Fairfield University
https://www.whitecase.com/people/kerrick-seay,JD St. John's University School of Law
https://www.whitecase.com/people/kerrick-seay,Bachelor of Science University of Missouri Columbia
https://www.whitecase.com/people/reuben-sequeira,JD Georgetown University Law Center
https://www.whitecase.com/people/reuben-sequeira,MBA Katholieke Universiteit Leuven
https://www.whitecase.com/people/reuben-sequeira,"BS Engineering Physics, International Studies Westmont College"
https://www.whitecase.com/people/tami-stark,JD Fordham University School of Law
https://www.whitecase.com/people/tami-stark,BA James Madison University
https://www.whitecase.com/people/isaac-tendler,LLM Taxation Georgetown University Law Center
https://www.whitecase.com/people/isaac-tendler,JD Hofstra University School of Law
https://www.whitecase.com/people/isaac-tendler,BTL Ner Israel Rabbinical College
https://www.whitecase.com/people/amit-thakore,JD Harvard Law School
https://www.whitecase.com/people/amit-thakore,BS Biology Massachusetts Institute of Technology
https://www.whitecase.com/people/robert-tiedemann,JD New York University School of Law
https://www.whitecase.com/people/robert-tiedemann,BA Hofstra University
https://www.whitecase.com/people/jonathan-ulrich,JD University of Virginia
https://www.whitecase.com/people/jonathan-ulrich,Princeton University
https://www.whitecase.com/people/andrew-vinci,JD Vanderbilt University Law School
https://www.whitecase.com/people/andrew-vinci,BA Yale University
https://www.whitecase.com/people/duane-wall,LLM New York University
https://www.whitecase.com/people/duane-wall,JD University of Oklahoma College of Law
https://www.whitecase.com/people/duane-wall,BA Southern Nazarene University
https://www.whitecase.com/people/claire-watson,LLB University of Edinburgh
https://www.whitecase.com/people/claire-watson,Diploma in Legal Practice University of Edinburgh
https://www.whitecase.com/people/joshua-weedman,JD University of Michigan Law School
https://www.whitecase.com/people/joshua-weedman,BA Furman University
https://www.whitecase.com/people/nicholas-wilkins,JD Harvard Law School
https://www.whitecase.com/people/nicholas-wilkins,BA/MA Boston University
https://www.whitecase.com/people/kristina-zissis,"JD American University, Washington College of Law"
https://www.whitecase.com/people/kristina-zissis,MA Johns Hopkins University School of Advanced International Studies (SAIS)
https://www.whitecase.com/people/kristina-zissis,BA Johns Hopkins University
https://www.whitecase.com/people/nicolas-abbattista,JD Vanderbilt University Law School
https://www.whitecase.com/people/nicolas-abbattista,BA Philosophy University of Miami
https://www.whitecase.com/people/alexander-abedine,JD New York University School of Law
https://www.whitecase.com/people/alexander-abedine,MSc London School of Economics
https://www.whitecase.com/people/alexander-abedine,BA Emory University
https://www.whitecase.com/people/deema-abini,JD University of Southern California Gould School of Law
https://www.whitecase.com/people/deema-abini,BA University of Southern California
https://www.whitecase.com/people/adam-acosta,JD Howard University School of Law
https://www.whitecase.com/people/adam-acosta,BA University of Maryland College Park
https://www.whitecase.com/people/kevin-adam,JD Suffolk University Law School
https://www.whitecase.com/people/kevin-adam,BS Suffolk University
https://www.whitecase.com/people/brya-adams,Howard University School of Law
https://www.whitecase.com/people/brya-adams,Clark Atlanta University
https://www.whitecase.com/people/joyce-adetutu,JD University of Denver
https://www.whitecase.com/people/joyce-adetutu,BS University of Colorado Colorado Springs
https://www.whitecase.com/people/christoffer-adler,LLM USC Gould School of Law
https://www.whitecase.com/people/christoffer-adler,LLM Stockholm University Sweden
https://www.whitecase.com/people/nathan-aduddell,JD University of Oklahoma College of Law
https://www.whitecase.com/people/nathan-aduddell,BA Theatre Performance Marymount Manhattan College
https://www.whitecase.com/people/calum-agnew,JD University of Toronto Faculty of Law
https://www.whitecase.com/people/calum-agnew,MPhil Christ's College University of Cambridge
https://www.whitecase.com/people/calum-agnew,BAH University of King's College
https://www.whitecase.com/people/celine-aka,JD Washington University in St. Louis
https://www.whitecase.com/people/celine-aka,BA University of Illinois at Urbana-Champaign
https://www.whitecase.com/people/taylor-akerblom,JD Loyola Law School Los Angeles
https://www.whitecase.com/people/taylor-akerblom,BA University of California
https://www.whitecase.com/people/ata-akiner,JD Georgetown University Law Center
https://www.whitecase.com/people/ata-akiner,MPhil International Relations University of Cambridge
https://www.whitecase.com/people/ata-akiner,BA History and Political Science Rutgers University
https://www.whitecase.com/people/jarrah-al-buainain,"JD University of California, Berkeley School of Law"
https://www.whitecase.com/people/jarrah-al-buainain,BA Fordham University Lincoln Center
https://www.whitecase.com/people/alysha-alibhai,JD University of Calgary
https://www.whitecase.com/people/alysha-alibhai,JD University of Houston
https://www.whitecase.com/people/alysha-alibhai,BA University of Washington
https://www.whitecase.com/people/luke-allen,JD Washington University School of Law
https://www.whitecase.com/people/luke-allen,BA Midwestern State University
https://www.whitecase.com/people/steven-amrein,JD University of Oklahoma College of Law
https://www.whitecase.com/people/steven-amrein,BA Rockhurst University
https://www.whitecase.com/people/andrea-amulic,JD University of Michigan Law School
https://www.whitecase.com/people/andrea-amulic,BA Connecticut College
https://www.whitecase.com/people/alexander-andresian,JD Harvard Law School
https://www.whitecase.com/people/alexander-andresian,MSc University of Oxford
https://www.whitecase.com/people/alexander-andresian,BA Columbia University
https://www.whitecase.com/people/allain-andry,JD University of Virginia School of Law
https://www.whitecase.com/people/allain-andry,BA University of San Diego
https://www.whitecase.com/people/norah-arafeh,"JD University of California, Berkeley School of Law"
https://www.whitecase.com/people/norah-arafeh,"BA University of California, Berkeley"
https://www.whitecase.com/people/ana-maria-arias,JD Harvard Law School
https://www.whitecase.com/people/ana-maria-arias,BA Florida International University
https://www.whitecase.com/people/helen-arshansky,JD Loyola Law School Los Angeles
https://www.whitecase.com/people/helen-arshansky,"BS California State University, Northridge"
https://www.whitecase.com/people/danielle-audette,JD University of Miami School of Law
https://www.whitecase.com/people/danielle-audette,BA College of the Holy Cross
https://www.whitecase.com/people/quentin-ayukesong,JD Washington University in St. Louis School of Law
https://www.whitecase.com/people/quentin-ayukesong,MS Columbia University
https://www.whitecase.com/people/quentin-ayukesong,BS University of Illinois at Urbana-Champaign
https://www.whitecase.com/people/joe-babitz,JD University of Virginia School of Law
https://www.whitecase.com/people/joe-babitz,BA University of Miami
https://www.whitecase.com/people/elena-baca,JD Northwestern University School of Law
https://www.whitecase.com/people/elena-baca,BA in political science University of Southern California
https://www.whitecase.com/people/gabriela-baca,"JD American University, Washington College of Law American University Law Review"
https://www.whitecase.com/people/gabriela-baca,BS in Foreign Service Georgetown University Latin American Studies Certificate
https://www.whitecase.com/people/audrey-bae,JD New York University School of Law
https://www.whitecase.com/people/audrey-bae,"BA University of California, Berkeley"
https://www.whitecase.com/people/amy-bagdasarian,JD Santa Clara University
https://www.whitecase.com/people/amy-bagdasarian,"BA University of California, Los Angeles"
https://www.whitecase.com/people/hailey-bair,JD Northwestern University School of Law
https://www.whitecase.com/people/hailey-bair,BA The George Washington University
https://www.whitecase.com/people/brett-bakemeyer,Juris Doctor Georgetown University Law Center
https://www.whitecase.com/people/evelyn-balassiano,LLM The University of Chicago Law School
https://www.whitecase.com/people/evelyn-balassiano,LLB Universidade do Estado do Rio de Janeiro
https://www.whitecase.com/people/nate-bascom,Juris Doctor Duke University School of Law
https://www.whitecase.com/people/nate-bascom,Bachelor of Arts Brigham Young University
https://www.whitecase.com/people/brandon-batzel,JD Fordham University School of Law
https://www.whitecase.com/people/brandon-batzel,BA University of Pennsylvania
https://www.whitecase.com/people/ashley-bean,JD UCLA School of Law
https://www.whitecase.com/people/ashley-bean,BS Georgetown University
https://www.whitecase.com/people/isabella-bellera-landa,JD Duke University School of Law
https://www.whitecase.com/people/isabella-bellera-landa,Duke-Geneva Institute in Transnational Law
https://www.whitecase.com/people/isabella-bellera-landa,"Abogado, Universidad de Carabobo"
https://www.whitecase.com/people/gabriella-bensur,JD Cornell Law School
https://www.whitecase.com/people/gabriella-bensur,BA Government and Philosophy Cornell University
https://www.whitecase.com/people/christopher-bergan,Juris Doctor Boston College Law School
https://www.whitecase.com/people/christopher-bergan,Bachelor of Arts College of the Holy Cross
https://www.whitecase.com/people/adam-berkaw,JD Columbia Law School
