profile_link,education
https://www.whitecase.com/people/andrew-de-lotbiniere-mcdougall,"Fox Scholarship, The Harold G. Fox Education Fund, Middle Temple, London"
https://www.whitecase.com/people/andrew-de-lotbiniere-mcdougall,LLL (Civil Law) University of Ottawa
https://www.whitecase.com/people/andrew-de-lotbiniere-mcdougall,LLB (Common Law) University of Ottawa Nelligan Power Prize for Highest Standing in Trial Advocacy (A+)
https://www.whitecase.com/people/andrew-de-lotbiniere-mcdougall,BA (Political Science & Economics) Universite Laval Quebec City
https://www.whitecase.com/people/valerie-menard,DESS Law and Science of European Employment Law University of Toulouse
https://www.whitecase.com/people/valerie-menard,Master's Degree in Administration University of Warwick
https://www.whitecase.com/people/charles-nairac,CAPA Paris Bar School
https://www.whitecase.com/people/charles-nairac,Diplome d'Etudes Approfondies - Droit International Prive et Droit du Commerce International (Postgraduate Degree in International Law) University of Paris II Pantheon-Assas
https://www.whitecase.com/people/charles-nairac,Maitrise en Droit des Affaires University of Paris I Pantheon-Sorbonne
https://www.whitecase.com/people/charles-nairac,Bachelor of Laws (LLB) King's College London
https://www.whitecase.com/people/nathalie-negre-eveillard,"Master in Business Law Universite Paris XI, Jean Monnet"
https://www.whitecase.com/people/nathalie-negre-eveillard,Master in Management Ecole des Hautes Etudes Commerciales (HEC) Paris
https://www.whitecase.com/people/kirsten-odynski,LLB University of Ottawa
https://www.whitecase.com/people/kirsten-odynski,BA (Hons) University of Alberta
https://www.whitecase.com/people/elizabeth-oger-gross,JD New York University School of Law
https://www.whitecase.com/people/elizabeth-oger-gross,Masters in International Affairs Institut d'Etudes Politiques de Paris
https://www.whitecase.com/people/elizabeth-oger-gross,BS Georgetown University
https://www.whitecase.com/people/franck-peter,DEA Business Law Universite Paris X-Nanterre
https://www.whitecase.com/people/franck-peter,MA Business Law Universite de Paris I Pantheon Sorbonne
https://www.whitecase.com/people/xavier-petet,"Master, Business Law University of Paris XI in cooperation with ESCP-EAP in Paris"
https://www.whitecase.com/people/xavier-petet,"Master, Tax Law University Paris II, Pantheon-Assas"
https://www.whitecase.com/people/marc-petitier,Postgraduate degree in business administration Pantheon-Sorbonne (Paris 1) IAE
https://www.whitecase.com/people/marc-petitier,Master in corporate law and postgraduate degree in contract law University of Versailles Saint-Quentin
https://www.whitecase.com/people/estelle-philippi,"Postgraduate Professional Degree, Master/DJCE in Business Law University of Nancy"
https://www.whitecase.com/people/estelle-philippi,Master's Degree European Business Law University of Nancy
https://www.whitecase.com/people/estelle-philippi,University of Cologne
https://www.whitecase.com/people/jean-pierre-picca,National School of the Judiciary
https://www.whitecase.com/people/jean-pierre-picca,University of Paris II Pantheon-Assas Institute of Judicial Studies
https://www.whitecase.com/people/jean-pierre-picca,University of Paris II Pantheon-Assas Masters (Maitrise) in Private Law
https://www.whitecase.com/people/roman-picherack,BCL/LLB McGill University Faculty of Law
https://www.whitecase.com/people/roman-picherack,BA International Relations University of British Columbia
https://www.whitecase.com/people/raphael-richard,DESS Business Law (Droit des Affaires) University of Paris XII
https://www.whitecase.com/people/raphael-richard,"Diploma, Economic and Financial Section Institut d'Etudes Politiques de Paris"
https://www.whitecase.com/people/raphael-richard,Master in Business Law University of Lyon III
https://www.whitecase.com/people/severin-robillard,Postgraduate Degree Banking and Financial Law University of Paris I Pantheon-Sorbonne
https://www.whitecase.com/people/severin-robillard,Master's Degree Business Law University of Paris X
https://www.whitecase.com/people/emilie-rogey,Postgraduate Degree in Banking and Financial Law Universite Pantheon-Assas
https://www.whitecase.com/people/emilie-rogey,Postgraduate Degree in Business Law Universite Pantheon-Assas
https://www.whitecase.com/people/emilie-rogey,Graduate Degree in Business Law and Tax Universite Pantheon-Assas
https://www.whitecase.com/people/emilie-rogey,Undergraduate Degree in Private Law Universite Pantheon-Assas
https://www.whitecase.com/people/jean-lou-salha,Master of Laws in Commercial & Corporate Law London School of Economics and Political Science
https://www.whitecase.com/people/jean-lou-salha,Advanced Post-graduate degree in Business Law and D.J.C.E. University of Paris II Pantheon-Assas
https://www.whitecase.com/people/christopher-seppala,JD Columbia Law School
https://www.whitecase.com/people/christopher-seppala,BA Harvard University
https://www.whitecase.com/people/max-turner,JD University of Pennsylvania
https://www.whitecase.com/people/max-turner,BA Haverford College
https://www.whitecase.com/people/yann-utzschneider,Postgraduate degree in Management & Law ESCP Europe
https://www.whitecase.com/people/yann-utzschneider,Master's degree in Political Sciences Robert Schuman University
https://www.whitecase.com/people/yann-utzschneider,DEA (Postgraduate degree) in European and International Law Robert Schuman University
https://www.whitecase.com/people/francois-guilhem-vaissier,Paris Bar School
https://www.whitecase.com/people/francois-guilhem-vaissier,Maitrise de Droit (JD equivalent) with a special focus on Business Law Universite Pantheon-Sorbonne
https://www.whitecase.com/people/francois-guilhem-vaissier,"Master Level Degree, Economics and Finance Institut de Sciences Politiques Paris, 1997 - 2001"
https://www.whitecase.com/people/guillaume-vallat,Post-graduate degree (DESS) in Corporate and Tax Law University of Paris I Sorbonne
https://www.whitecase.com/people/guillaume-vallat,HEC (School of Management) Paris
https://www.whitecase.com/people/guillaume-vitrich,Secretaire de la Conference des avocats du barreau de Paris
https://www.whitecase.com/people/guillaume-vitrich,LLM Master de droit New York University
https://www.whitecase.com/people/guillaume-vitrich,"Master Business Law DJCE Universite Paris II, Pantheon-Assas"
https://www.whitecase.com/people/christophe-von-krause,DESS droit des affaires (post-graduate degree in Business Law) University of Rennes
https://www.whitecase.com/people/christophe-von-krause,Diplome Juriste Conseil d'Entreprise (LLM) University of Rennes
https://www.whitecase.com/people/christophe-von-krause,Maitrise droit des affaires (JD) University of Paris II Pantheon-Assas
https://www.whitecase.com/people/john-willems,JD University of Virginia School of Law Executive Editor of Virginia Journal of International Law
https://www.whitecase.com/people/john-willems,BA History Brown University
https://www.whitecase.com/people/angelica-andre,"LLM International Dispute Resolution Queen Mary College, University of London"
https://www.whitecase.com/people/angelica-andre,DEA Contract and Property Law Paris I - Pantheon Sorbonne
https://www.whitecase.com/people/angelica-andre,Maitrise in French and German Laws Paris I - Pantheon Sorbonne
https://www.whitecase.com/people/angelica-andre,LLM Cologne - Paris I University of Cologne
https://www.whitecase.com/people/julien-bensaid,Cornell University Law School Juris Doctor
https://www.whitecase.com/people/julien-bensaid,JD Universite de Paris I Pantheon Sorbonne
https://www.whitecase.com/people/julien-bensaid,Universite Paris I-Sorbonne Maitrise de Droit des Affaires
https://www.whitecase.com/people/julien-bensaid,"Universite de Paris IX - Dauphine Maitrise de Sciences de Gestion, filiere Finance"
https://www.whitecase.com/people/orion-berg,DEA International Private Law Universite de Paris I Pantheon Sorbonne
https://www.whitecase.com/people/paule-biensan,DEA Post-master's (DEA) in Business Law Universite de Droit de Paris II
https://www.whitecase.com/people/paule-biensan,Master's (Maitrise) in Business Law Universite de Droit de Paris X
https://www.whitecase.com/people/olga-fedosova,"LPC The College of Law, London"
https://www.whitecase.com/people/olga-fedosova,"GDL and LLB in Law BPP Law School, London"
https://www.whitecase.com/people/olga-fedosova,PhD in Russian Corporate Law Academy of National Economy under the Government of Russian Federation
https://www.whitecase.com/people/olga-fedosova,Degree in Law Academy of National Economy under the Government of Russian Federation
https://www.whitecase.com/people/cenzi-gargaro,"Diploma in Advanced European Law College of Europe Bruges, Belgium"
https://www.whitecase.com/people/cenzi-gargaro,Diploma in Legal Practice
https://www.whitecase.com/people/cenzi-gargaro,LLB (Honours) University of Strathclyde Scotland
https://www.whitecase.com/people/estelle-jegou,LLM EU and Competition Law King's College London
https://www.whitecase.com/people/estelle-jegou,"DESS (MA equivalent) in EU Law Universite Paris XI, Jean Monnet"
https://www.whitecase.com/people/estelle-jegou,"Master, Business and Tax Law Universite Paris II, Pantheon-Assas"
https://www.whitecase.com/people/emmanuel-lebaube,DESS of Banking and Financial Law University of Paris I Pantheon-Sorbonne
https://www.whitecase.com/people/emmanuel-lebaube,DEA of Corporate Law University of Paris II Pantheon-Assas
https://www.whitecase.com/people/emmanuel-lebaube,"Master's Degree Corporate Law Universite Paris II, Pantheon-Assas"
https://www.whitecase.com/people/emmanuel-lebaube,Master's Degree in Civil Law University of Paris II Pantheon-Assas
https://www.whitecase.com/people/nicholas-macheras,Juris Doctor University of Toronto Faculty of Law
https://www.whitecase.com/people/nicholas-macheras,"Bachelor of Arts, Interdisciplinary Studies University of British Columbia Faculty of Arts"
https://www.whitecase.com/people/agathe-malphettes,"Master 2, Multimedia and Computer Science, University Paris II University Paris II, Pantheon-Assas"
https://www.whitecase.com/people/agathe-malphettes,"Master 2, Literary, Artistic and Industrial Property University Paris II, Pantheon-Assas"
https://www.whitecase.com/people/sophie-nguyen,Post-Graduate Professional Degree in International Business Law University of Aix-Marseille III Paul Cezanne
https://www.whitecase.com/people/sophie-nguyen,Master's Degree Business Law University of Lyon III Jean Moulin
https://www.whitecase.com/people/sophie-nguyen,Certificate of Legal Studies University of Manchester
https://www.whitecase.com/people/sophie-nguyen,"Academic Degree of Common Law, Institute of Comparative Law University of Lyon III"
https://www.whitecase.com/people/jean-paszkudzki,HEC Paris
https://www.whitecase.com/people/jean-paszkudzki,"Bachelor's degree in Corporate Law Universite Paris XI, Jean Monnet"
https://www.whitecase.com/people/carine-piade,DEA in Criminal Law University of Aix-en-Provence
https://www.whitecase.com/people/carine-piade,Maitrise in Business Law University of Paris I Pantheon-Sorbonne
https://www.whitecase.com/people/anastasia-pitchouguina,Master of Management and International Law HEC Paris
https://www.whitecase.com/people/anastasia-pitchouguina,Postgraduate Degree in International Law University of Paris II Assas
https://www.whitecase.com/people/anastasia-pitchouguina,Master of International Commercial Law University of Paris X Nanterre
https://www.whitecase.com/people/anastasia-pitchouguina,LLB St. Petersburg University Russia
https://www.whitecase.com/people/mickael-rivollier,Institut d'Etudes Politiques de Paris
https://www.whitecase.com/people/mickael-rivollier,"Master's Degree in Business Law Universite Paris I, Pantheon-Sorbonne"
https://www.whitecase.com/people/ece-akincibay,Master II Arbitration and International Commercial Law Paris I Pantheon-Sorbonne
https://www.whitecase.com/people/ece-akincibay,"Master II, International Economic Law Paris I Pantheon-Sorbonne, Sciences Po Paris and Columbia Law School"
https://www.whitecase.com/people/ece-akincibay,Diploma in Legal Studies University of Oxford New College
https://www.whitecase.com/people/ece-akincibay,Master I Comparative and English Law Paris II Pantheon-Assas
https://www.whitecase.com/people/ece-akincibay,Bachelor of Laws Paris II Pantheon-Assas
https://www.whitecase.com/people/elina-aleynikova,Master 2 Droit des affaires Universite Paris-Cergy
https://www.whitecase.com/people/elina-aleynikova,JD University of Pittsburgh School of Law
https://www.whitecase.com/people/elina-aleynikova,LLM University of Pittsburgh School of Law
https://www.whitecase.com/people/elina-aleynikova,Rostov State Economic University Faculty of Law
https://www.whitecase.com/people/francesca-annicchiarico,LPC BPP University
https://www.whitecase.com/people/francesca-annicchiarico,GDL City University
https://www.whitecase.com/people/francesca-annicchiarico,BA Harvard University
https://www.whitecase.com/people/niels-ardeo-winter,"Master 2, Banking and Financial Law University Paris II, Pantheon-Assas"
https://www.whitecase.com/people/niels-ardeo-winter,"Master 2, Business Law Universite Paris V Rene Descartes"
https://www.whitecase.com/people/niels-aujouannet-kelner,"LLM International Business Regulation, Litigation and Arbitration New York University"
https://www.whitecase.com/people/niels-aujouannet-kelner,"Advanced Master's Degree, International Business Law and Management ESSEC Business School"
https://www.whitecase.com/people/niels-aujouannet-kelner,"Master II International Trade Law Universite Paris I, Pantheon-Sorbonne"
https://www.whitecase.com/people/niels-aujouannet-kelner,"Master I International Law Universite Paris I, Pantheon-Sorbonne"
https://www.whitecase.com/people/niels-aujouannet-kelner,License in Law Universite Aix-Marseille & Stockholm University
https://www.whitecase.com/people/tala-ayoub,"Master II Business Law, specialized in Financial Law Universite de Paris I Pantheon Sorbonne"
https://www.whitecase.com/people/tala-ayoub,"Master II International Business Law Universite Jean Moulin, Lyon III"
https://www.whitecase.com/people/maud-balagna,Master II Droit des Creations Immaterielles (IP/IT law) University of Montpellier I France
https://www.whitecase.com/people/maud-balagna,Master I Business and common law University College Cork Ireland
https://www.whitecase.com/people/maud-balagna,Bachelor in civil and business law University of Lyon III France
https://www.whitecase.com/people/alexandre-balat,"Master 2 Professional in Business & Tax Law Universite Paris II, Pantheon-Assas"
https://www.whitecase.com/people/alexandre-balat,"Master 2 Professional in Banking & Financial Law Universite Paris II, Pantheon-Assas"
https://www.whitecase.com/people/alicia-bali,Master 2 Professional Universite Paris II Pantheon-Assas
https://www.whitecase.com/people/alicia-bali,M.S.c Strategy and Management of International Business ESSEC Business School
https://www.whitecase.com/people/laure-bauduret,Programme Grande Ecole HEC (School of Management)
https://www.whitecase.com/people/laure-bauduret,Master 2 Business and Tax Law Pantheon-Sorbonne (Paris 1)
https://www.whitecase.com/people/laure-bauduret,Master 1 Business Law Pantheon-Sorbonne (Paris 1)
https://www.whitecase.com/people/barbara-bensoussan,JD UCLA School of Law
https://www.whitecase.com/people/barbara-bensoussan,BA Political Science UCLA
https://www.whitecase.com/people/ahmed-boulahcen,LLM International Financial Law King's College London
https://www.whitecase.com/people/ahmed-boulahcen,Master 2 Financial Law University of Paris I Pantheon-Sorbonne
https://www.whitecase.com/people/ahmed-boulahcen,Master 2 Business Law Paris Dauphine University
https://www.whitecase.com/people/ahmed-boulahcen,Master 1 Business Law Universite de Paris I Pantheon Sorbonne
https://www.whitecase.com/people/pierre-boussard,"Universite Paris I, Pantheon-Sorbonne"
https://www.whitecase.com/people/pierre-boussard,"University Paris II, Pantheon-Assas"
https://www.whitecase.com/people/henri-bousseau,MSc Management EM Lyon Business School
https://www.whitecase.com/people/henri-bousseau,Post-Master's Degree Corporate Tax Law Universite Paris Dauphine
https://www.whitecase.com/people/henri-bousseau,Master's Degree Business Law Universite Paris II Pantheon-Assas
https://www.whitecase.com/people/henri-bousseau,Bachelor's Degree Law Universite Paris II Pantheon-Assas
https://www.whitecase.com/people/heloise-broc,Master II International Business Law University of Paris Sud XI Jean Monnet
https://www.whitecase.com/people/heloise-broc,Master I International Business Law University of Paris I Pantheon-Sorbonne
https://www.whitecase.com/people/alain-chan-hon,Paris Bar School
https://www.whitecase.com/people/alain-chan-hon,Master II Law and Finance Paris Dauphine University
https://www.whitecase.com/people/alain-chan-hon,LLM International Financial Law King's College London
https://www.whitecase.com/people/faustine-chapelin,"LLM Queen Mary School of International Arbitration, London"
https://www.whitecase.com/people/faustine-chapelin,Master II University of Paris-Dauphine Paris
https://www.whitecase.com/people/alice-chavaillard,LLM Cornell Law School New York
https://www.whitecase.com/people/alice-chavaillard,Post-Master's Degree in Banking and Financial Law University of Paris II Pantheon-Assas
https://www.whitecase.com/people/alice-chavaillard,Post-Master's Degree in Business Law University of Paris II Pantheon-Assas
https://www.whitecase.com/people/alice-chavaillard,Master's Degree in Business Law University of Paris II Pantheon-Assas
https://www.whitecase.com/people/emmanuel-chevignon,"Master 2 - Business and Tax Law Universite Pantheon-Assas, Paris II"
https://www.whitecase.com/people/emmanuel-chevignon,"Master 1 - Business Law Universite Paris Ouest, Nanterre La Defense"
https://www.whitecase.com/people/hugo-chevillot,"Master 2 Business and Taw Law Universite Pantheon-Assas, Paris II"
https://www.whitecase.com/people/hugo-chevillot,Master of Laws (LLM) International Financial Law King's College London
https://www.whitecase.com/people/benedicte-cheyrou-lagreze,Post-Master's Degree Law and Business HEC Lausanne Switzerland
https://www.whitecase.com/people/benedicte-cheyrou-lagreze,Post-Master's Degree European Business law University of Nice Sophia-Antipolis France
https://www.whitecase.com/people/benedicte-cheyrou-lagreze,Master's Degree Business law University of East Anglia England
https://www.whitecase.com/people/anouk-clamens,Master II Business Law University of Paris II Pantheon-Assas (MA equivalent)
https://www.whitecase.com/people/anouk-clamens,MBA University of Paris II Pantheon-Assas
https://www.whitecase.com/people/charles-connesson,"Master 2 in Business Law, Corporate Law University of Paris X Nanterre"
https://www.whitecase.com/people/charles-connesson,"Master 1 in Business Law, Financial Markets & Banking University of Paris X Nanterre"
https://www.whitecase.com/people/charles-connesson,Bachelor's Degree General Public & Private Law University of Paris X Nanterre
https://www.whitecase.com/people/camille-coulon,Master II European and International Business Law University of Paris-Dauphine
https://www.whitecase.com/people/camille-coulon,Master I Business Law University of Paris-Dauphine
https://www.whitecase.com/people/michel-courtois,LLM Business Law University of Paris II Pantheon-Assas INSEAD
https://www.whitecase.com/people/michel-courtois,Post-Master's Degree Business Law University of Paris V Rene Descartes
https://www.whitecase.com/people/michel-courtois,Master's Degree Business Law University of Paris II Pantheon-Assas
https://www.whitecase.com/people/anna-dai,LLM Harvard Law School Marco Polo Fellow
https://www.whitecase.com/people/anna-dai,Master of Laws in International Law Fudan University
https://www.whitecase.com/people/anna-dai,LLB East China University of Political Science and Law
https://www.whitecase.com/people/anna-dai,Certificate International Academy for Arbitration Law
https://www.whitecase.com/people/anna-dai,Certificate Program in Mediation Bucerius Law School
https://www.whitecase.com/people/mathieu-damnon,Advanced Master's Degree in International Business Law and Management ESSEC
https://www.whitecase.com/people/mathieu-damnon,Post-Master's Degree in European Business Law University of Paris II Pantheon-Assas
https://www.whitecase.com/people/mathieu-damnon,Master Degree in English Law University College London
https://www.whitecase.com/people/bettina-de-catalogne,JD Columbia Law School
https://www.whitecase.com/people/bettina-de-catalogne,BA Economics New York University
https://www.whitecase.com/people/quirec-de-kersauson,Master 2 Public Law University of Paris II Pantheon-Assas
https://www.whitecase.com/people/quirec-de-kersauson,Master 2 European Litigation University of Paris II Pantheon-Assas
https://www.whitecase.com/people/quirec-de-kersauson,Diploma European Affairs Paris Institute of Political Studies
https://www.whitecase.com/people/agathe-delalande,MM HEC Paris
https://www.whitecase.com/people/agathe-delalande,Post-Master's Degree Paris I La Sorbonne University
https://www.whitecase.com/people/nelson-dijoux-coquillas,"LLM University of California, Berkeley"
https://www.whitecase.com/people/nelson-dijoux-coquillas,MBA University of Paris II Pantheon-Assas
https://www.whitecase.com/people/nelson-dijoux-coquillas,"Master II, Business Law University of Paris II Pantheon-Assas"
https://www.whitecase.com/people/nelson-dijoux-coquillas,"Master I, Law University of Paris-Dauphine"
https://www.whitecase.com/people/nelson-dijoux-coquillas,"Joint Licence degree, Law and Economics & Management University of Paris-Dauphine"
https://www.whitecase.com/people/gregoire-durand,LLM University of Chicago Law School
https://www.whitecase.com/people/gregoire-durand,Master II in Economic Law Sciences Po Law School
https://www.whitecase.com/people/gregoire-durand,Bachelor of Arts Sciences Po Paris (Institut d'Etudes Politiques de Paris)
https://www.whitecase.com/people/clementine-durney,CAPA Versailles Bar School
https://www.whitecase.com/people/clementine-durney,"Advanced Master's in Intellectual Property and New Technologies Paris I - Pantheon Sorbonne, and Paris-Sud (Sceaux)"
https://www.whitecase.com/people/clementine-durney,Master of Laws International Law Paris I - Pantheon Sorbonne
https://www.whitecase.com/people/polly-efstratiadi,Bar Professional Training Course (BPTC) BPP Law School
https://www.whitecase.com/people/polly-efstratiadi,Master of International Law University College London
https://www.whitecase.com/people/polly-efstratiadi,"BA, LLB Law (Hons) Oxford University"
https://www.whitecase.com/people/yasmine-el-achkar,"Master II Litigation, Arbitration and ADR Universite Paris II Pantheon-Assas"
https://www.whitecase.com/people/yasmine-el-achkar,"Master II Global Business Law and Governance Universite Paris 1 Pantheon-Sorbonne, Columbia Law School, and Sciences Po Paris"
https://www.whitecase.com/people/yasmine-el-achkar,Bachelor of Laws (LLB) International and European Law Universite Paris 1 - Pantheon-Sorbonne
https://www.whitecase.com/people/yasmine-el-achkar,Bachelor of Arts Political Studies American University of Beirut
https://www.whitecase.com/people/laure-elbaze,"LLM Business Law University of California, Berkeley"
https://www.whitecase.com/people/laure-elbaze,"ESSEC Business School, Grande Ecole"
https://www.whitecase.com/people/laure-elbaze,Post-Master's Degree Business Law University of Paris II Pantheon-Assas
https://www.whitecase.com/people/laure-elbaze,Master's Degree Business Law University of Paris I Pantheon-Sorbonne
https://www.whitecase.com/people/maud-elezam,JD Loyola Law School Los Angeles
https://www.whitecase.com/people/maud-elezam,BA Political Science UCLA
https://www.whitecase.com/people/julie-ernewein,"Postgraduate Professional Degree, Master/DJCE in Business Law University of Nancy"
https://www.whitecase.com/people/julie-ernewein,"Master's Degree, Tax and Business Law University of Nancy"
https://www.whitecase.com/people/julien-etchegaray,LLM London School of Economics and Political Science
https://www.whitecase.com/people/julien-etchegaray,Master's Degree in Business and Tax Law University of Paris I Pantheon-Sorbonne
https://www.whitecase.com/people/julien-etchegaray,Magistere of Business Law University of Paris I Pantheon-Sorbonne
https://www.whitecase.com/people/julien-etchegaray,Bachelor's Degree Law University of Paris I Pantheon-Sorbonne
https://www.whitecase.com/people/maud-fillon,MSc International Business Law and Management ESCP Europe Business School
https://www.whitecase.com/people/maud-fillon,"Master 1, Business Law, DJCE Universite Lyon III, Jean Moulin"
https://www.whitecase.com/people/maud-fillon,"Master 1, Business Law, DJCE Universite Lyon III, Jean Moulin"
https://www.whitecase.com/people/camille-fouque,Master of Laws (LLM) HEC Paris
https://www.whitecase.com/people/camille-fouque,Master 2 Public Law of Affairs Paris I - Pantheon Sorbonne
https://www.whitecase.com/people/emma-france,Diploma - Energy Law University of Paris I Pantheon-Sorbonne
https://www.whitecase.com/people/emma-france,Master 2 - Public Business Law University of Paris I Pantheon-Sorbonne
https://www.whitecase.com/people/emma-france,Master 2 - Public Affairs Institut d'Etudes Politiques d'Aix-en-Provence
https://www.whitecase.com/people/gustavo-gaspar-nogueira,LLM Queen Mary University of London
https://www.whitecase.com/people/gustavo-gaspar-nogueira,LLB University of Sao Paulo
https://www.whitecase.com/people/gustavo-gaspar-nogueira,Certificate in Law Ludwig Maximilian University of Munich
https://www.whitecase.com/people/maeva-gatineau,Magistere in Business Law University of Paris I Pantheon-Sorbonne
https://www.whitecase.com/people/maeva-gatineau,Master 2 in Financial Law University of Paris I Pantheon-Sorbonne
