profile_link,education
https://www.whitecase.com/people/lee-carroll,BCL University of Oxford
https://www.whitecase.com/people/lee-carroll,LLB University of Western Australia
https://www.whitecase.com/people/lee-carroll,BA University of Western Australia
https://www.whitecase.com/people/andrew-clark,LLB (Hons) University of Melbourne
https://www.whitecase.com/people/andrew-clark,BComm (Hons) University of Melbourne
https://www.whitecase.com/people/ged-cochrane,LLB (Hons) Monash University
https://www.whitecase.com/people/ged-cochrane,BA Monash University
https://www.whitecase.com/people/aldrin-de-zilva,Masters of Taxation (Hons) Melbourne University
https://www.whitecase.com/people/aldrin-de-zilva,LLB (Hons) Melbourne University
https://www.whitecase.com/people/aldrin-de-zilva,Bachelor of Commerce (Hons) Melbourne University
https://www.whitecase.com/people/joanne-draper,Graduate Certificate in Applied Finance and Investment Institute of Australasia (FINSIA)
https://www.whitecase.com/people/joanne-draper,LLB (Honours) /BComm (Honours) Monash University
https://www.whitecase.com/people/christopher-flynn,Masters of Letters University of St Andrews Chevening Scholar
https://www.whitecase.com/people/christopher-flynn,Master of Laws University of Sydney
https://www.whitecase.com/people/christopher-flynn,Ambassadorial Scholar Universidad de Salamanca
https://www.whitecase.com/people/christopher-flynn,Bachelor of Laws (Hons) Griffith University
https://www.whitecase.com/people/christopher-flynn,Bachelor of Commerce Griffith University
https://www.whitecase.com/people/michelle-keen,LLM Environmental Australian National University
https://www.whitecase.com/people/michelle-keen,LLB Monash University
https://www.whitecase.com/people/michelle-keen,BA Environmental Science Monash University
https://www.whitecase.com/people/tim-kennedy,"LLM Christ's College, Cambridge"
https://www.whitecase.com/people/tim-kennedy,"LLB, BCom University of Adelaide South Australia"
https://www.whitecase.com/people/jared-muller,LLB/BBus Queensland University of Technology
https://www.whitecase.com/people/nirangjan-nagarajah,LLB Macquarie University
https://www.whitecase.com/people/nirangjan-nagarajah,Bachelor of Commerce Macquarie University
https://www.whitecase.com/people/candice-ota,LLB (Hons) Monash University
https://www.whitecase.com/people/candice-ota,BA Monash University
https://www.whitecase.com/people/adeline-pang,LLM University of Melbourne
https://www.whitecase.com/people/adeline-pang,LLB Monash University
https://www.whitecase.com/people/adeline-pang,BComm Monash University
https://www.whitecase.com/people/kate-perumal,Master of Business Admin Australian Graduate School of Management
https://www.whitecase.com/people/kate-perumal,Master of Law University of New South Wales
https://www.whitecase.com/people/kate-perumal,Bachelor of Laws (Hons I) University of Technology Sydney
https://www.whitecase.com/people/kate-perumal,Bachelor of Business University of Technology Sydney
https://www.whitecase.com/people/tim-power,LLM Environmental University of Adelaide
https://www.whitecase.com/people/tim-power,LLB University of Adelaide
https://www.whitecase.com/people/tim-power,BA Jurisprudence University of Adelaide
https://www.whitecase.com/people/brendan-quinn,LLB (Hons) B. Juris Monash University
https://www.whitecase.com/people/joel-rennie,LLB The University of Western Australia
https://www.whitecase.com/people/joel-rennie,BSc Marine Science The University of Western Australia
https://www.whitecase.com/people/alan-rosengarten,LLB BEcon Monash University
https://www.whitecase.com/people/alan-rosengarten,Graduate Diploma Applied Finance Financial Services Institute of Australasia (FINSIA)
https://www.whitecase.com/people/josh-sgro,LLB (Hons) University of Melbourne
https://www.whitecase.com/people/josh-sgro,BComm (Hons) University of Melbourne
https://www.whitecase.com/people/brad-strahorn,Bachelor of Business University of Southern Queensland
https://www.whitecase.com/people/brad-strahorn,Bachelor of Laws Griffith University
https://www.whitecase.com/people/brad-strahorn,Master of Laws Corporate and Commercial Law University of Queensland
https://www.whitecase.com/people/john-tivey,Master of Laws Monash University
https://www.whitecase.com/people/john-tivey,Bachelor of Laws Monash University
https://www.whitecase.com/people/john-tivey,Bachelor of Economics Monash University
https://www.whitecase.com/people/cameron-watson,LLB University of Canterbury New Zealand
https://www.whitecase.com/people/cameron-watson,BCom University of Canterbury New Zealand
https://www.whitecase.com/people/cameron-watson,Level I of the Chartered Financial Analyst (CFA) Program
https://www.whitecase.com/people/mark-montag,LLB (Hons) Monash University
https://www.whitecase.com/people/mark-montag,BSc Monash University
https://www.whitecase.com/people/andrea-castle,LLB (Hons) La Trobe University
https://www.whitecase.com/people/andrea-castle,BA La Trobe University
https://www.whitecase.com/people/hilary-cure,Bachelor of Commerce and Laws (Hons) University of Tasmania
https://www.whitecase.com/people/fiona-curl,LLB (Hons) Monash University
https://www.whitecase.com/people/fiona-curl,BA Monash University
https://www.whitecase.com/people/tim-neilson,LLB (Hons) University of Melbourne
https://www.whitecase.com/people/tim-neilson,Master of Laws London University
https://www.whitecase.com/people/david-opperman,LLB and B.Juris Economics (Accounting) Major Monash University
https://www.whitecase.com/people/amanda-osuchowski,BComm/LLB (Hons) University of Tasmania
https://www.whitecase.com/people/dan-paolini,Master of Laws Masters of Laws University of Melbourne
https://www.whitecase.com/people/dan-paolini,Bachelor of Laws Monash University
https://www.whitecase.com/people/dan-paolini,Bachelor of Science University of Melbourne
https://www.whitecase.com/people/andrea-reeves,Bachelor of Laws (Hons Division A) Monash University
https://www.whitecase.com/people/andrea-reeves,Bachelor of Science (Hons) Monash University
https://www.whitecase.com/people/andrea-reeves,Bachelor of Science Monash University
https://www.whitecase.com/people/nicholas-rouse,Masters of Taxation University of Melbourne
https://www.whitecase.com/people/nicholas-rouse,Bachelor of Commerce University of Melbourne
https://www.whitecase.com/people/tara-agoston,LLM University College London
https://www.whitecase.com/people/tara-agoston,LLB University of Melbourne
https://www.whitecase.com/people/tara-agoston,BCom University of Melbourne
https://www.whitecase.com/people/irene-argeres,LLB (Hons) Monash University
https://www.whitecase.com/people/irene-argeres,BA Monash University
https://www.whitecase.com/people/irene-argeres,Diploma of Languages (Italian) Monash University
https://www.whitecase.com/people/andrew-baker,Bachelor of Arts Monash University
https://www.whitecase.com/people/andrew-baker,Juris Doctor Monash University
https://www.whitecase.com/people/emanuel-blum,Graduate Diploma of Legal Practice College of Law
https://www.whitecase.com/people/emanuel-blum,Juris Doctor University of Sydney Law School
https://www.whitecase.com/people/emanuel-blum,Master of Arts Carnegie Mellon University
https://www.whitecase.com/people/emanuel-blum,Bachelor of Arts University of Waterloo
https://www.whitecase.com/people/kirsty-campbell,LLB (Honours) University of Sydney
https://www.whitecase.com/people/kirsty-campbell,BA (Geology major) University of Sydney
https://www.whitecase.com/people/henry-carlson,JD University of Melbourne
https://www.whitecase.com/people/henry-carlson,Bachelor of Commerce University of Melbourne
https://www.whitecase.com/people/stephen-carlton,JD RMIT University
https://www.whitecase.com/people/stephen-carlton,Dip Ed Latrobe University
https://www.whitecase.com/people/stephen-carlton,BA Contemporary European Studies Latrobe University
https://www.whitecase.com/people/kevin-chen,LLB University of New South Wales
https://www.whitecase.com/people/kevin-chen,BComm University of New South Wales
https://www.whitecase.com/people/ashleigh-cole,LLB (Hons) / BA Monash University
https://www.whitecase.com/people/kristian-cywicki,Bachelor of Laws (Dist.) University of Western Australia
https://www.whitecase.com/people/kristian-cywicki,Bachelor of Science University of Western Australia
https://www.whitecase.com/people/isabela-deveza,LLB University of Adelaide
https://www.whitecase.com/people/isabela-deveza,Bachelor of Laws Pontificia Universidade Catolica de Sao Paulo
https://www.whitecase.com/people/emma-dobb,Master of Laws Juris Doctor Monash University
https://www.whitecase.com/people/emma-dobb,Bachelor of Science Legal and Dispute Studies RMIT University
https://www.whitecase.com/people/chenez-dyer-bray,BA University of Melbourne
https://www.whitecase.com/people/chenez-dyer-bray,JD University of Melbourne
https://www.whitecase.com/people/dion-english,Bachelor of Laws (Hons) Monash University
https://www.whitecase.com/people/dion-english,Bachelor of Commerce Monash University
https://www.whitecase.com/people/dion-english,Diploma Monash University
https://www.whitecase.com/people/alexis-fong,LLB (Hons) University of Melbourne
https://www.whitecase.com/people/alexis-fong,BCom (Major in Finance) University of Melbourne
https://www.whitecase.com/people/jennifer-galatas,LLM University of Melbourne
https://www.whitecase.com/people/jennifer-galatas,LLB (Hons) University of Melbourne
https://www.whitecase.com/people/jennifer-galatas,BComm (Hons) University of Melbourne
https://www.whitecase.com/people/ostiane-goh-livorness,PCLL The Chinese University of Hong Kong
https://www.whitecase.com/people/ostiane-goh-livorness,LLB (Hons) University of Nottingham
https://www.whitecase.com/people/kirsty-ha,Juris Doctor University of Melbourne
https://www.whitecase.com/people/kirsty-ha,Bachelor of Commerce University of Melbourne
https://www.whitecase.com/people/kirsty-ha,Graduate Diploma Legal Practice College of Law
https://www.whitecase.com/people/jessie-huynh,Juris Doctor University of Melbourne
https://www.whitecase.com/people/jessie-huynh,Bachelor of Commerce University of Melbourne
https://www.whitecase.com/people/danielle-ingham,LLB University of Birmingham
https://www.whitecase.com/people/danielle-ingham,Postgraduate Diploma in Legal Practice BPP Law School
https://www.whitecase.com/people/isabella-jarrett,BA Geography Oxford University
https://www.whitecase.com/people/isabella-jarrett,Graduate Diploma in Law College of Law
https://www.whitecase.com/people/ruveena-kaliannan,Juris Doctor University of Melbourne
https://www.whitecase.com/people/ruveena-kaliannan,Bachelor of Arts University of Western Australia
https://www.whitecase.com/people/mai-kuroda,LLB (Hons) University of Melbourne
https://www.whitecase.com/people/mai-kuroda,BA University of Melbourne
https://www.whitecase.com/people/paul-marshall,LLB La Trobe University
https://www.whitecase.com/people/paul-marshall,Masters of International Studies University of Sydney
https://www.whitecase.com/people/paul-marshall,BEng (Aerospace) / BBus Admin RMIT University
https://www.whitecase.com/people/andrew-mason,LLB (Hons) Murdoch University
https://www.whitecase.com/people/barnaby-matthews,LLB (Hons) Monash University
https://www.whitecase.com/people/naomi-midha,Bachelor of Commerce (Economics)/LLB Griffith University
https://www.whitecase.com/people/kian-newlyn,LLB Australian National University
https://www.whitecase.com/people/sarah-oh,Bachelor of Laws University of Sydney
https://www.whitecase.com/people/sarah-oh,Bachelor of Science University of Sydney
https://www.whitecase.com/people/daniel-oneil,BIGS (Hons) University of Sydney
https://www.whitecase.com/people/daniel-oneil,MPhil University of Oxford
https://www.whitecase.com/people/daniel-oneil,JD University of Melbourne
https://www.whitecase.com/people/marco-paoletti,MA University of Oxford
https://www.whitecase.com/people/marco-paoletti,MPhil University of Cambridge
https://www.whitecase.com/people/marco-paoletti,LLM (JD) Monash University
https://www.whitecase.com/people/jacqui-pavlidis,Master of Laws (Juris Doctor) Monash University
https://www.whitecase.com/people/jacqui-pavlidis,Bachelor of Business (Banking and Finance) Monash University
https://www.whitecase.com/people/jacqui-pavlidis,Bachelor of Business (Accounting) Monash University
https://www.whitecase.com/people/suzie-porritt,Bachelor of Arts University of Melbourne
https://www.whitecase.com/people/suzie-porritt,Juris Doctor Monash University
https://www.whitecase.com/people/girish-rao,LLB University of South Australia
https://www.whitecase.com/people/matt-sercombe,LLB (Hons) Deakin University
https://www.whitecase.com/people/matt-sercombe,BSc (Hons) Applied Chemistry Curtin University
https://www.whitecase.com/people/ned-simpson,Bachelor of Architecture Deakin University
https://www.whitecase.com/people/ned-simpson,LLB (Hons) La Trobe University
https://www.whitecase.com/people/kirsten-sugden,Juris Doctor University of Melbourne
https://www.whitecase.com/people/kirsten-sugden,Bachelor of Environments University of Melbourne
https://www.whitecase.com/people/nicolette-tan,Bachelor of Laws Monash University
https://www.whitecase.com/people/nicolette-tan,Bachelor of Commerce Monash University
https://www.whitecase.com/people/zachary-tyler,JD Georgetown University Law Center
https://www.whitecase.com/people/zachary-tyler,"Certificate, Johns Hopkins University - Nanjing University Center for Chinese and America Studies, Nanjing, China"
https://www.whitecase.com/people/zachary-tyler,BA Georgetown University
https://www.whitecase.com/people/chris-wallace,Bachelor of Arts Oxford University
https://www.whitecase.com/people/chris-wallace,Postgraduate Diploma in Legal Practice BPP Law School
https://www.whitecase.com/people/courtney-white,Bachelor of Laws Monash University
https://www.whitecase.com/people/yushu-xie,JD University of Sydney
https://www.whitecase.com/people/yushu-xie,BA Jinan University
https://www.whitecase.com/people/samuel-scoles,Mastering Trade Policy Executive Education Program Harvard University John F. Kennedy School of Government
https://www.whitecase.com/people/samuel-scoles,"MA International Economics and Southeast Asian Studies Johns Hopkins University School of Advanced International Studies (SAIS) Washington, DC"
https://www.whitecase.com/people/samuel-scoles,"Indonesian Language Proficiency Gadjah Mada University Yogyakarta, Indonesia"
https://www.whitecase.com/people/samuel-scoles,"French Language Proficiency, Institut de Langue et de Culture Francaises Universite Catholique Lyon, France"
https://www.whitecase.com/people/samuel-scoles,"Thai Language Proficiency Chiang Mai University Chiang Mai, Thailand"
https://www.whitecase.com/people/samuel-scoles,BA History and Art Westmont College
https://www.whitecase.com/people/anita-hormis,Bachelor of Laws (Hons) University of Sheffield
https://www.whitecase.com/people/anita-hormis,Postgraduate Diploma in Legal Practice University of Sheffield
https://www.whitecase.com/people/anna-oreilly,LLB (Hons) University of Tasmania
https://www.whitecase.com/people/anna-oreilly,BComm University of Tasmania
https://www.whitecase.com/people/juraj-fuska,"JUDr Comenius University School of Law Bratislava, Slovak Republic"
https://www.whitecase.com/people/juraj-fuska,"Mgr Comenius University School of Law Bratislava, Slovak Republic"
https://www.whitecase.com/people/zoran-draskovic,"Mgr, Faculty of Law Comenius University Bratislava, Slovak Republic"
https://www.whitecase.com/people/zoran-draskovic,"Ing, Faculty of International Relations University of Economics Bratislava, Slovak Republic"
https://www.whitecase.com/people/vladimir-ivanco,"JUDr University of Pavol Jozef Safarik Bratislava, Slovak Republic"
https://www.whitecase.com/people/vladimir-ivanco,LLM Ghent University Law School Belgium
https://www.whitecase.com/people/vladimir-ivanco,"Master's degree University of Pavol Jozef Safarik Kosice, Slovak Republic"
https://www.whitecase.com/people/michal-palisin,LLM Ghent University Law School Belgium
https://www.whitecase.com/people/michal-palisin,"Master's degree, Faculty of Law Comenius University Bratislava, Slovak Republic"
https://www.whitecase.com/people/peter-hodal,LLM University of Virginia School of Law USA
https://www.whitecase.com/people/peter-hodal,Master's degree University of Economics
https://www.whitecase.com/people/peter-hodal,"Master's degree Comenius University School of Law Bratislava, Slovak Republic"
https://www.whitecase.com/people/olga-oveckova,"Lectureship Comenius University School of Law Bratislava, Slovak Republic"
https://www.whitecase.com/people/olga-oveckova,"DrSc Comenius University School of Law Bratislava, Slovak Republic"
https://www.whitecase.com/people/olga-oveckova,"CSc Comenius University School of Law Bratislava, Slovak Republic"
https://www.whitecase.com/people/olga-oveckova,"JUDr Comenius University School of Law Bratislava, Slovak Republic"
https://www.whitecase.com/people/lukas-kralovic,"Ing., Master's Degree in Taxation and Tax Advisory University of Economics Bratislava, Slovak Republic"
https://www.whitecase.com/people/lukas-kralovic,"JUDr Pan-European University Bratislava, Slovak Republic"
https://www.whitecase.com/people/lukas-kralovic,"Bachelor's Degree in Business Economics and Management University of Economics Bratislava, Slovak Republic"
https://www.whitecase.com/people/lukas-kralovic,"Master's Degree in Law Comenius University Bratislava, Slovak Republic"
https://www.whitecase.com/people/barbora-malik,Master of Laws Charles University
https://www.whitecase.com/people/alex-medek,"Master's Degree Comenius University Faculty of Law Bratislava, Slovak Republic"
https://www.whitecase.com/people/martin-melicher,Master's Degree Comenius University Faculty of Law in Bratislava
https://www.whitecase.com/people/martin-melicher,Master's Degree Economy University of Economics in Bratislava
https://www.whitecase.com/people/martin-melicher,Bachelor's Degree Comenius University Faculty of Law in Bratislava
https://www.whitecase.com/people/martin-melicher,Bachelor's Degree Economy University of Economics in Bratislava
https://www.whitecase.com/people/martin-melicher,"Erasmus Programme, ISCTE - Lisbon University Institute"
https://www.whitecase.com/people/thierry-bosly,LLM Georgetown University
https://www.whitecase.com/people/thierry-bosly,Licence en Droit UCL
https://www.whitecase.com/people/thierry-bosly,Candidature en Droit Facultes Universitaires Saint Louis
https://www.whitecase.com/people/katarzyna-czapracka,JSD Columbia Law School
https://www.whitecase.com/people/katarzyna-czapracka,LLM Columbia Law School
https://www.whitecase.com/people/katarzyna-czapracka,Master of Laws Adam Mickiewicz University School of Law
https://www.whitecase.com/people/katarzyna-czapracka,MA Warsaw School of Economics
https://www.whitecase.com/people/genevra-forwood,Postgraduate Diploma in EU Competition Law King's College London
https://www.whitecase.com/people/genevra-forwood,Bar Vocational Course BPP Law School London
https://www.whitecase.com/people/genevra-forwood,Graduate Diploma in Law City University London
https://www.whitecase.com/people/genevra-forwood,"Masters College of Europe, Bruges"
https://www.whitecase.com/people/genevra-forwood,MA University of Edinburgh
https://www.whitecase.com/people/jeremie-jourdan,LLM College of Europe
https://www.whitecase.com/people/jeremie-jourdan,Master Business law Paris IX University (Dauphine)
https://www.whitecase.com/people/jeremie-jourdan,"Magistere BFA (Master's degree), Economics and Finance Paris IX University (Dauphine)"
https://www.whitecase.com/people/james-killick,Licence speciale en Droit europeen University of Brussels
https://www.whitecase.com/people/james-killick,LLM University of Cambridge
https://www.whitecase.com/people/james-killick,BA University of Cambridge
https://www.whitecase.com/people/assimakis-komninos,PhD European University Institute Italy
https://www.whitecase.com/people/assimakis-komninos,LLM New York University School of Law USA
https://www.whitecase.com/people/assimakis-komninos,"LLM Trinity College University of Cambridge, UK"
https://www.whitecase.com/people/assimakis-komninos,LLB University of Athens Greece
https://www.whitecase.com/people/tilman-kuhn,Dr jur University of Cologne
https://www.whitecase.com/people/tilman-kuhn,Second State Exam State of Northrhine-Westphalia
https://www.whitecase.com/people/tilman-kuhn,LLM University of Amsterdam
https://www.whitecase.com/people/tilman-kuhn,First State Exam Higher Regional Court of Cologne
https://www.whitecase.com/people/jacquelyn-maclennan,Diploma in Legal Practice University of Edinburgh
https://www.whitecase.com/people/jacquelyn-maclennan,LLB (Hons) University of Edinburgh
https://www.whitecase.com/people/mark-powell,Final Diploma in Portuguese Language and Literature University of Coimbra
https://www.whitecase.com/people/mark-powell,Professional Practising Certificate College of Law Chester
https://www.whitecase.com/people/mark-powell,LLB University of Lancaster
https://www.whitecase.com/people/strati-sakellariou-witt,LLM New York University School of Law
https://www.whitecase.com/people/strati-sakellariou-witt,LLM University of Athens
https://www.whitecase.com/people/strati-sakellariou-witt,LLB University of Athens
https://www.whitecase.com/people/strati-sakellariou-witt,University of Salamanca
https://www.whitecase.com/people/axel-schulz,"LLM European Law College of Europe, Bruges"
https://www.whitecase.com/people/axel-schulz,Law Degree University of Konstanz
https://www.whitecase.com/people/axel-schulz,Diploma University of Lyon
https://www.whitecase.com/people/hadrien-servais,LLM 1st in class New York University
https://www.whitecase.com/people/hadrien-servais,"Degree in Law, summa cum laude Catholic University of Louvain Belgium"
https://www.whitecase.com/people/thomas-glauden,LLM International Business and Commercial Law King's College London
https://www.whitecase.com/people/thomas-glauden,Master of Laws Universite Libre de Bruxelles
https://www.whitecase.com/people/thomas-glauden,Erasmus Universiteit van Amsterdam
https://www.whitecase.com/people/thomas-glauden,Bachelor of Laws Universite Libre de Bruxelles
https://www.whitecase.com/people/christophe-goossens,Special degree in tax law Universite Libre de Bruxelles
https://www.whitecase.com/people/christophe-goossens,Law Degree Universite Libre de Bruxelles
https://www.whitecase.com/people/alexandra-rogers,"LLM European Law College of Europe, Bruges"
https://www.whitecase.com/people/alexandra-rogers,LPC College of Law in Chester
https://www.whitecase.com/people/alexandra-rogers,LLB University of Durham
https://www.whitecase.com/people/kai-struckmann,Second State Examination in Law Judicial Examining Board of Berlin
https://www.whitecase.com/people/kai-struckmann,Master of Law in European Law University of Nottingham
https://www.whitecase.com/people/kai-struckmann,Judicial Examining Board of Lower Saxony First State Examination in Law
https://www.whitecase.com/people/olivier-vanhulst,Master of Laws Vrije Universiteit Brussel
https://www.whitecase.com/people/olivier-vanhulst,Erasmus University of Copenhagen
https://www.whitecase.com/people/olivier-vanhulst,Bachelor of Laws Vrije Universiteit Brussel
https://www.whitecase.com/people/christoph-arhold,Second State Exam Higher Regional Court of Saarbrucken
https://www.whitecase.com/people/christoph-arhold,First State Exam University of Saarland
https://www.whitecase.com/people/nicholas-forwood,Bachelor's Degree Mechanical Sciences Cambridge University
https://www.whitecase.com/people/nicholas-forwood,Law Degree Cambridge University
https://www.whitecase.com/people/charles-julien,"Masters in International Law Universite Pantheon-Sorbonne Visiting Researcher, Harvard Law School"
https://www.whitecase.com/people/charles-julien,Masters in Comparative Law Universite Pantheon-Assas
https://www.whitecase.com/people/charles-julien,JD Universite Pantheon-Sorbonne
https://www.whitecase.com/people/richard-king,"JD The American University, Washington College of Law"
https://www.whitecase.com/people/richard-king,BA History Carleton College
https://www.whitecase.com/people/sara-nordin,LLM Chinese Law Hong Kong University
https://www.whitecase.com/people/sara-nordin,JD Brooklyn Law School
https://www.whitecase.com/people/sara-nordin,BA Political Science and Media Hunter College NY
https://www.whitecase.com/people/willem-van-de-wiele,LLM New York University
https://www.whitecase.com/people/willem-van-de-wiele,Degree in Law Universiteit Gent
https://www.whitecase.com/people/fanny-abouzeid,"LLM College of Europe, Bruges"
https://www.whitecase.com/people/fanny-abouzeid,LLM University of Paris I Pantheon-Sorbonne
https://www.whitecase.com/people/fanny-abouzeid,LLM University of Paris II Pantheon-Assas & University College London
https://www.whitecase.com/people/geraldine-amory,Master of Laws Universite Catholique de Louvain-la-Neuve
https://www.whitecase.com/people/geraldine-amory,Erasmus Universidade de Lisboa
https://www.whitecase.com/people/geraldine-amory,Bachelor of Laws Universite Saint-Louis de Bruxelles
https://www.whitecase.com/people/geraldine-amory,"University Foundation Programme St Clare's, Oxford"
https://www.whitecase.com/people/alissa-arms,Second State Exam Higher Regional Court of Berlin
https://www.whitecase.com/people/alissa-arms,LLM Intellectual Property and Information Law King's College London
https://www.whitecase.com/people/alissa-arms,Master of Laws (maitrise) European Law University of Paris II Pantheon-Assas
https://www.whitecase.com/people/alissa-arms,First State Exam Humboldt University of Berlin
https://www.whitecase.com/people/mario-barka,"LLM College of Europe, Bruges"
https://www.whitecase.com/people/mario-barka,Master's Degree University of Paris I Pantheon-Sorbonne
